{
  "id": "DEBT-0002",
  "title": "Refactor pipeline state management to use centralized state with proper caching",
  "description": "The current pipeline feature uses local component state with prop drilling across 5+ component levels, making it difficult to maintain and causing unnecessary re-renders. We need to refactor to a centralized state management solution (Redux/Zustand) with proper caching and optimistic updates.",
  "featureId": "FEAT-0005",
  "status": "prioritized",
  "impact": {
    "severity": "high",
    "areas": ["performance", "maintainability", "developer-experience"],
    "description": "Current state management architecture causes excessive re-renders impacting performance with large deal counts. Prop drilling makes the code fragile and difficult to modify. New features require touching 5+ files to add simple functionality. Developer onboarding is slowed by 2-3 days due to complex state flow. Performance issues are directly contributing to BUG-0003.",
    "metrics": [
      {
        "metric": "Component re-render count",
        "currentValue": "Average 15 re-renders per user action",
        "targetValue": "Average 2-3 re-renders per action"
      },
      {
        "metric": "Time to implement new pipeline feature",
        "currentValue": "3-4 days average",
        "targetValue": "1-2 days average"
      },
      {
        "metric": "Developer onboarding time for pipeline code",
        "currentValue": "2-3 days to understand",
        "targetValue": "4-6 hours to understand"
      }
    ]
  },
  "effort": {
    "estimate": "large",
    "complexity": "medium",
    "storyPoints": 13,
    "dependencies": [
      "Must coordinate with BUG-0003 fix to avoid duplicate work",
      "Need to maintain backward compatibility during migration",
      "Requires comprehensive testing to prevent regressions"
    ]
  },
  "proposedSolution": "Implement Zustand for lightweight centralized state management. Create separate stores for deals, filters, and UI state. Implement React Query for server state management and caching. Add memoization with React.memo and useMemo. Refactor components to subscribe only to needed state slices. Create migration path to gradually refactor existing components.",
  "assignee": "chris.anderson",
  "priority": "high",
  "metadata": {
    "createdAt": "2025-03-04T11:00:00Z",
    "updatedAt": "2025-03-05T09:30:00Z",
    "createdBy": "tech-lead",
    "tags": ["deals", "pipeline", "state-management", "refactoring", "performance"]
  }
}
